id,location,city,ward,district,bedrooms,bathrooms,size_sqm,property_type,listing_type,price_tzs,description,amenities,owner_name,owner_phone,owner_email,latitude,longitude,created_at,status
203,Mbogwe,Geita,Mbogwe,Mbogwe,4,2,83,Guest_House,rent,894154,"Spacious Guest House in the heart of Mbogwe. Features 4 bedrooms, 2 bathrooms, and 83 sqm of living space.","Storage, Gated Community, Garden, Solar Water Heater",Robert Kalenga,+255 637476487,robert.kalenga@example.com,-3.0508923467350924,33.10609113928775,2026-02-13 11:48:23.657020,available
204,Katoro,Geita,Katoro,Katoro,1,1,34,Bedsitter,rent,126488,"Modern Bedsitter in Katoro, Geita. Excellent condition with recent renovations. Ideal location with easy access to amenities.","Pool, Ceramic Tiles, Water, Garden, Solar Water Heater, Balcony",Fatuma Ali,+255 686164137,fatuma.ali@example.com,-1.8503108201416278,36.474080368653865,2025-04-30 11:48:23.657039,available
205,Nzera,Geita,Nzera,Nzera,1,1,27,Master_Room,rent,301894,Stunning Master Room with 27 sqm of space. Located in the desirable Nzera neighborhood of Geita.,"Air Conditioning, Balcony, Security, Playground",Frank Mwanga,+255 656563824,frank.mwanga@example.com,-10.496958688213878,38.41344819162206,2025-09-20 11:48:23.657058,available
206,Bukombe,Geita,Bukombe,Bukombe,1,1,42,1_Bedroom_Apt,rent,312397,"Beautiful 1 Bedroom Apt located in Bukombe, Geita. Perfect for individuals with 1 bedrooms and modern amenities.","WiFi, Balcony, Water, Garden",Elizabeth Mwangaza,+255 674457305,elizabeth.mwangaza@example.com,-7.413583476010159,36.40292214236449,2025-10-22 11:48:23.657076,available
207,Mbarali,Songwe,Mbarali,Mbarali,1,1,36,1_Bedroom_Apt,rent,481000,"Modern 1 Bedroom Apt in Mbarali, Songwe. Excellent condition with recent renovations. Ideal location with easy access to amenities.","Gated Community, Solar Water Heater, Ceramic Tiles, Pool, Balcony, Water, Security",Elizabeth Mwangaza,+255 633388891,elizabeth.mwangaza@example.com,-7.753493137465803,38.06531135683057,2025-11-16 11:48:23.657098,available
208,Isaka,Songwe,Isaka,Isaka,1,1,27,Master_Room,rent,243416,"Spacious Master Room in the heart of Isaka. Features 1 bedrooms, 1 bathrooms, and 27 sqm of living space.","Pool, Water, Gym",Anna Massawe,+255 693349680,anna.massawe@example.com,-9.306465696839936,39.69078626933306,2025-07-04 11:48:23.657117,available
209,Chunya,Songwe,Chunya,Chunya,1,1,15,Single_Room,rent,48818,"Well-maintained Single Room offering 1 bedrooms in Chunya. Close to schools, hospitals, and shopping centers.","Aluminum Windows, Elevator, Storage, Air Conditioning",Michael Nyoni,+255 629909087,michael.nyoni@example.com,-5.374521039627703,31.826552436489507,2025-12-14 11:48:23.657136,available
210,Mbarali,Songwe,Mbarali,Mbarali,3,3,117,3_Bedroom_Apt,rent,852804,"Beautiful 3 Bedroom Apt located in Mbarali, Songwe. Perfect for family with 3 bedrooms and modern amenities.","Gym, Aluminum Windows, Backup Generator, Water, Ceramic Tiles",Aisha Hassan,+255 730098545,aisha.hassan@example.com,-6.31881084426701,30.715973706576882,2026-03-23 11:48:23.657155,available
211,Vwawa,Songwe,Vwawa,Vwawa,1,1,14,Single_Room,rent,54515,"Spacious Single Room in the heart of Vwawa. Features 1 bedrooms, 1 bathrooms, and 14 sqm of living space.","Electricity, Aluminum Windows, Parking, Elevator, Air Conditioning, WiFi, Storage, Ceramic Tiles",Susan Kiwanga,+255 788505399,susan.kiwanga@example.com,-1.9333203653503546,34.83759326324224,2026-02-10 11:48:23.657175,available
212,Igurusi,Songwe,Igurusi,Igurusi,1,1,37,1_Bedroom_Apt,rent,190466,"Modern 1 Bedroom Apt in Igurusi, Songwe. Excellent condition with recent renovations. Ideal location with easy access to amenities.","Gym, Kitchen Cabinets, Built-in Wardrobes, Elevator, Playground, Balcony, Ceramic Tiles, Pool",Thomas Mcharo,+255 731411592,thomas.mcharo@example.com,-4.348984705305514,36.28283228192565,2025-06-30 11:48:23.657200,available
213,Vwawa,Songwe,Vwawa,Vwawa,4,2,115,Guest_House,rent,893008,"Well-maintained Guest House offering 4 bedrooms in Vwawa. Close to schools, hospitals, and shopping centers.","Storage, Pool, Gated Community, Garden",Grace Mbeya,+255 763435784,grace.mbeya@example.com,-2.489856741590053,33.27706840155071,2026-02-10 11:48:23.657220,available
214,Ileje,Songwe,Ileje,Ileje,1,1,34,Hotel_Room,rent,469488,"Spacious Hotel Room in the heart of Ileje. Features 1 bedrooms, 1 bathrooms, and 34 sqm of living space.","Kitchen Cabinets, Water, Pool, Built-in Wardrobes, Playground",Aisha Hassan,+255 633811063,aisha.hassan@example.com,-3.149056597998263,36.400973312187276,2025-08-31 11:48:23.657239,available
215,Mbarali,Songwe,Mbarali,Mbarali,1,0,18,Single_Room,rent,42485,Stunning Single Room with 18 sqm of space. Located in the desirable Mbarali neighborhood of Songwe.,"Gym, Storage, Parking, Garden, Gated Community",Robert Kalenga,+255 746657817,robert.kalenga@example.com,-3.6738323763199476,31.791591477230327,2026-02-12 11:48:23.657258,available
216,Vwawa,Songwe,Vwawa,Vwawa,3,3,179,Townhouse,rent,211882760,"Spacious Townhouse in the heart of Vwawa. Features 3 bedrooms, 3 bathrooms, and 179 sqm of living space.","Backup Generator, Electricity, Air Conditioning, Ceramic Tiles",Robert Kalenga,+255 750079847,robert.kalenga@example.com,-1.0670612203687107,30.893826855058165,2026-03-31 11:48:23.657278,available
